256,U45203TN1999GOI043322,KAMARAJAR PORT LIMITED,Active,RoC-Chennai,43322.0,Companies owned by the Government of India,Tamil Nadu,Company limited by Shares,Union Govt company,Public,1999-10-11 00:00:00,"22 years, 5 month, 27 days",Building of complete constructions or parts thereof; civil engineering,"₹5,000,000,000","₹3,000,000,000",Unlisted,2020-12-16 00:00:00,2020-03-31 00:00:00,MALLIKARJUNA VENKATA SUBBA RAO VAKATI,Email ID: info@kplmail.in,"2nd Floor (North wing) & 3rd Floor, Jawahar building, 17, Rajaji Salai, Chennai Chennai TN 600001 IN","Kamarajar Port Limited is a Public incorporated on 11 October 1999. It is classified as Union Govt company and is registered at Registrar of Companies, Chennai. Its authorized share capital is Rs. 5,000,000,000 and its paid up capital is Rs. 3,000,000,000. It is inolved in Building of complete constructions or parts thereof; civil engineering Kamarajar Port Limited's Annual General Meeting (AGM) was last held on 16 December 2020 and as per records from Ministry of Corporate Affairs (MCA), its balance sheet was last filed on 31 March 2020. Directors of Kamarajar Port Limited are Mallikarjuna Venkata Subba Rao Vakati, Sarla Balagopal, Raveendran Palaniyandi, Sadagopan Kumar Balajiarun, . Kamarajar Port Limited's Corporate Identification Number is (CIN) U45203TN1999GOI043322 and its registration number is 43322.Its Email address is info@kplmail.in and its registered address is 2nd Floor (North wing) & 3rd Floor, Jawahar building, 17, Rajaji Salai, Chennai Chennai TN 600001 IN , - , . Current status of Kamarajar Port Limited is - Active.","Thermal Coal, Automobiles, Project Cargo, LPG, POL, Chemical, other liquids, other bulk and rock mineral products",,,,,,,,,,,,,,,,,,,,,,,,,,,Public Sector Enterprise,"Website
http://www.kamarajarport.in/",,India,,"Ennore Port was originally conceived as a satellite port to the Chennai Port, primarily to handle thermal coal to meet the requirement of Tamil Nadu Electricity Board (TNEB), and was endowed with large chunks of land (about 2,000 acres). The scope was expanded taking into account subsequent developments such as the plan of Government of Tamil Nadu to set up a 1,880 mW LNG power project in association with a private consortium, a large petrochemical park and a naphtha cracker plant. Ennore Port was commissioned by the then Prime Minister of India Atal Bihari Vajpayee on 1 February 2001. The port was set up under the Companies Act, keeping it outside the scope of the Tariff Authority for Major Ports, the tariff regulator for 11 of the 12 ports owned by the Indian government. The port was declared as a major port under the Indian Ports Act, 1908 in March 1999 and incorporated as the Ennore Port Limited under the Companies Act, 1956 in October 1999.","Commissioned in 2001 and operating on a landlord port concept, it is outsourcing all services required for operation and maintenance, and new terminals are being developed with the participation of the private sector. During the year of 2010–11, it handled a total cargo of 11.01 million tons. The port has effectively taken over all the ore movement from the Chennai Port. By 2016, the port is expected to have the capacity to handle over 80 million tons of cargo and its coal-handling capacity is expected to be about 43 million tons. The port is equipped to handle 16 million tonnes of coal per year from its two dedicated coal berths with 15 m alongside depth and manned by TNEB, while its third berth promoted by Chettinad International Coal Terminal, is a common user facility that can handle 8 million tonnes per annum.",,,,https://en.wikipedia.org/wiki/Kamarajar_Port
257,U24231KA1981GOI004145,KARNATAKA ANTIBIOTICS AND PHARMACEUTICALS LIMITED,Active,RoC-Bangalore,4145.0,Companies owned by the Government of India,Karnataka,Company limited by Shares,Union Govt company,Public,1981-03-13 00:00:00,"41 years, 0 month, 25 days",Manufacture of other chemical products,"₹150,000,000","₹134,900,000",Unlisted,,2020-03-31 00:00:00,SUNIL KUMAR KAIMAL,Email ID: supriya@kaplindia.com,"DR.RAJAKUMAR ROAD,FIRST BLOCK, RAJAJINAGAR, BANGALORE. BANGALORE. KA 560010 IN","Karnataka Antibiotics And Pharmaceuticals Limited is a Public incorporated on 13 March 1981. It is classified as Union Govt company and is registered at Registrar of Companies, Bangalore. Its authorized share capital is Rs. 150,000,000 and its paid up capital is Rs. 134,900,000. It is inolved in Manufacture of other chemical products Karnataka Antibiotics And Pharmaceuticals Limited's Annual General Meeting (AGM) was last held on 25 September 2020 and as per records from Ministry of Corporate Affairs (MCA), its balance sheet was last filed on 31 March 2020. Directors of Karnataka Antibiotics And Pharmaceuticals Limited are Sunil Kumar Kaimal, Thichempully Krishnadas Anil Kumar, Tayappa Khanapure Bhagoji, . Karnataka Antibiotics And Pharmaceuticals Limited's Corporate Identification Number is (CIN) U24231KA1981GOI004145 and its registration number is 4145.Its Email address is supriya@kaplindia.com and its registered address is DR.RAJAKUMAR ROAD,FIRST BLOCK, RAJAJINAGAR, BANGALORE. BANGALORE. KA 560010 IN , - , . Current status of Karnataka Antibiotics And Pharmaceuticals Limited is - Active.",,,,,,,,,,,,,,,,,,,,,,,,,,,,Public Sector Enterprise,,,India,,,,,,,
258,U85110KA1980SGC003871,KARNATAKA SOAPS AND DETERGENTS LIMITED,Active,RoC-Bangalore,3871.0,Companies owned by State Government,Karnataka,Company limited by Shares,State Govt company,Public,1980-07-09 00:00:00,"41 years, 8 month, 29 days",Human health activities,"₹350,000,000","₹318,220,992",Unlisted,2021-01-28 00:00:00,2020-03-31 00:00:00,NAGASANDRA JAGANMATHA RAMAIAH,Email ID: mysoresandalmd@gmail.com,P.B.5531 POONA HIGHWAYBANGALORE BANGALORE KA 560055 IN,"Karnataka Soaps And Detergents Limited is a Public incorporated on 09 July 1980. It is classified as State Govt company and is registered at Registrar of Companies, Bangalore. Its authorized share capital is Rs. 350,000,000 and its paid up capital is Rs. 318,220,992. It is inolved in Human health activities Karnataka Soaps And Detergents Limited's Annual General Meeting (AGM) was last held on 28 January 2021 and as per records from Ministry of Corporate Affairs (MCA), its balance sheet was last filed on 31 March 2020. Directors of Karnataka Soaps And Detergents Limited are Nagasandra Jaganmatha Ramaiah, Karimallappa Madal Virupakshappa, . Karnataka Soaps And Detergents Limited's Corporate Identification Number is (CIN) U85110KA1980SGC003871 and its registration number is 3871.Its Email address is mysoresandalmd@gmail.com and its registered address is P.B.5531 POONA HIGHWAYBANGALORE BANGALORE KA 560055 IN , - , . Current status of Karnataka Soaps And Detergents Limited is - Active.","Soaps, detergents, sandalwood oil, fragrances, hand washes, face washes, coconut oil, agarbathis, liquid detergents",,,"Bangalore, Karnataka, India",,,,,,"Maharaja Krishna Raja Wadiyar IV
M. Visvesvaraya",,,,,,,,,,,,,,,,,,Public Sector Enterprise,mysoresandal.org,,India,,"Karnataka Soaps and Detergents Limited (KSDL) is an Indian company, owned by the Government of Karnataka, that manufacturers personal care products including Mysore Sandal Soap. It was founded as Government Sandalwood Oil Factory in 1916 by Maharaja Krishna Raja Wadiyar IV and M. Visvesvaraya for extracting and exporting sandalwood oil. It launched Mysore Sandal Soap in 1918, and has since manufactured soaps and cosmetics products. The company became a public sector enterprise in 1980 and was renamed as KSDL.
KSDL obtained the Geographical Indication tag for Mysore Sandal Soap and Mysore Sandalwood Oil in 2006. Apart from soaps and sandalwood oil, KSDL manufactures detergents, fragrances, talcum powder, hand washes, face washes, coconut oil and agarbathis. It has manufacturing facilities in Bangalore, Mysore and Shimoga, and exports its products to 11 countries as of 2019.",,,,,https://en.wikipedia.org/wiki/Karnataka_Soaps_and_Detergents_Limited
259,U27100KA2014GOI077968,KARNATAKA VIJAYNAGAR STEEL LIMITED,Active,RoC-Bangalore,77968.0,Companies owned by the Government of India,Karnataka,Company limited by Shares,Union Govt company,Private,2014-12-29 00:00:00,"7 years, 3 month, 9 days",Manufacture of Basic Iron & Steel,"₹1,000,000","₹1,000,000",Unlisted,2020-09-04 00:00:00,2020-03-31 00:00:00,SATYANARAYANA MURTY KONDEPUDI,Email ID: cs@nmdc.co.in,"NO.57(2), KANAKAPURA ROAD NR.KRISHNA RAO CIRCLE BASAVANAGUDI Bangalore KA 560004 IN","Karnataka Vijaynagar Steel Limited is a Private incorporated on 29 December 2014. It is classified as Union Govt company and is registered at Registrar of Companies, Bangalore. Its authorized share capital is Rs. 1,000,000 and its paid up capital is Rs. 1,000,000. It is inolved in Manufacture of Basic Iron & Steel Karnataka Vijaynagar Steel Limited's Annual General Meeting (AGM) was last held on 04 September 2020 and as per records from Ministry of Corporate Affairs (MCA), its balance sheet was last filed on 31 March 2020. Directors of Karnataka Vijaynagar Steel Limited are Satyanarayana Murty Kondepudi, Bhimasen Sahoo, . Karnataka Vijaynagar Steel Limited's Corporate Identification Number is (CIN) U27100KA2014GOI077968 and its registration number is 77968.Its Email address is cs@nmdc.co.in and its registered address is NO.57(2), KANAKAPURA ROAD NR.KRISHNA RAO CIRCLE BASAVANAGUDI Bangalore KA 560004 IN , - , . Current status of Karnataka Vijaynagar Steel Limited is - Active.",,,,,,,,,,,,,,,,,,,,,,,,,,,,Public Sector Enterprise,,,India,,,,,,,
260,,Khadi Natural Healthcare,Active,,,Private Limited Company,,Company limited by Shares,,Private,,,"manufacturer, exporter and supplier for natural and authentic products",,,Unlisted,,,SH GAURAV SINGH,,"JANAKPURI, NEW DELHI-110058 INDIA",,,,,,,,,,,,,,,,,,,,,,,,,,,,,Public Sector Enterprise,https://www.khadinatural.com/about,,India,,"Khadi Natural Healthcare is a leading manufacturer, exporter and supplier for natural and authentic products covering 18 States and 35 authorized distributors all over India. Khadi Natural exports all around the world in 25 countries with above 50 authorized seller and distributors.

We are affianced in the manufacturing of Khadi Natural herbal shampoo’s, Natural and Glycerin soaps, and Paraben free cleansers..

Khadi Natural products are manufactured under the supervision of qualified Ayurvedic Doctors and the products are made up of Herbal active elements which are articulated from organically grown pure plant extracts. Khadi Natural products are of WHO, GMP and ISO standards and they inculcate the ideologies of preservative formulae for everyday uses.",,,,,https://en.wikipedia.org/w/index.php?title=Khadi_Natural&action=edit&redlink=1
261,U14297DL2019PTC353677,KHANIJ BIDESH INDIA LIMITED,Active,RoC-Delhi,353677.0,Private Limited Company,Delhi,Company limited by Shares,Non-govt company,Private,2019-08-08 00:00:00,"2 years, 7 month, 30 days","Mining and quarrying , n.e.c.","₹1,000,000,000","₹25,000,000",Unlisted,2020-11-19 00:00:00,2020-03-31 00:00:00,SRIDHAR PATRA,Email ID: company_secretary@nalcoindia.co.in,"CORE-4, 5TH FLOOR, SOUTH TOWER DISTRICT CENTRE, SCOPE MINAR, LAXMI NAGAR DELHI East Delhi DL 110092 IN","Khanij Bidesh India Limited is a Private incorporated on 08 August 2019. It is classified as Non-govt company and is registered at Registrar of Companies, Delhi. Its authorized share capital is Rs. 1,000,000,000 and its paid up capital is Rs. 25,000,000. It is inolved in Mining and quarrying , n.e.c. Khanij Bidesh India Limited's Annual General Meeting (AGM) was last held on 19 November 2020 and as per records from Ministry of Corporate Affairs (MCA), its balance sheet was last filed on 31 March 2020. Directors of Khanij Bidesh India Limited are Sridhar Patra, Arun Kumar Shukla, Sanjay Lohiya, Veena Kumari Dermal, Satendra Singh, Ranjit Rath, . Khanij Bidesh India Limited's Corporate Identification Number is (CIN) U14297DL2019PTC353677 and its registration number is 353677.Its Email address is company_secretary@nalcoindia.co.in and its registered address is CORE-4, 5TH FLOOR, SOUTH TOWER DISTRICT CENTRE, SCOPE MINAR, LAXMI NAGAR DELHI East Delhi DL 110092 IN , - , . Current status of Khanij Bidesh India Limited is - Active.","Khadi Natural herbal shampoo’s, Natural and Glycerin soaps, and Paraben free cleansers.",,,,,,,,,,,,,,,,,,,,,,,,,,,Public Sector Enterprise,,,India,,,,,,,
262,U35201MH1990GOI223738,KONKAN RAILWAY CORPORATION LIMITED,Active,RoC-Mumbai,223738.0,Companies owned by the Government of India,Maharashtra,Company limited by Shares,Union Govt company,Public,1990-07-19 00:00:00,"31 years, 8 month, 19 days",Manufacture of railway and tramway locomotives and rolling stock,"₹80,795,099,000","₹57,030,386,000",Unlisted,2021-09-27 00:00:00,2021-03-31 00:00:00,KAPIL MOHAN,Email ID: compsec@krcl.co.in,"KONKAN RAILWAY CORPORATION LIMITED, BELAPUR BHAVAN SECTOR-11, CBD BELAPUR NAVI MUMBAI MH 400614 IN","Konkan Railway Corporation Limited is a Public incorporated on 19 July 1990. It is classified as Union Govt company and is registered at Registrar of Companies, Mumbai. Its authorized share capital is Rs. 80,795,099,000 and its paid up capital is Rs. 57,030,386,000. It is inolved in Manufacture of railway and tramway locomotives and rolling stock Konkan Railway Corporation Limited's Annual General Meeting (AGM) was last held on 27 September 2021 and as per records from Ministry of Corporate Affairs (MCA), its balance sheet was last filed on 31 March 2021. Directors of Konkan Railway Corporation Limited are Kapil Mohan, Anju Ranjan, Sanjay Gupta, Santosh Kumar Jha, Rajesh Mithalal Bhadang, Ashish Kumar Singh, . Konkan Railway Corporation Limited's Corporate Identification Number is (CIN) U35201MH1990GOI223738 and its registration number is 223738.Its Email address is compsec@krcl.co.in and its registered address is KONKAN RAILWAY CORPORATION LIMITED, BELAPUR BHAVAN SECTOR-11, CBD BELAPUR NAVI MUMBAI MH 400614 IN , - , . Current status of Konkan Railway Corporation Limited is - Active.",,,Railways,Navi Mumbai,1990-07-19 00:00:00,,,"Maharashtra, Goa and Karnataka",₹236.52 crore (US$31 million) (2019),,"₹6,114.70 crore (US$800 million) (2019)",,,"₹2,068.53 crore (US$270 million) (2019)",Indian Railways,,,"₹2,898.68 crore (US$380 million) (2019)",,,,,,5351(March 2020),,"Sanjay Gupta
(Chairman & MD)",₹102.00 crore (US$13 million) (2019),Public Sector Enterprise,KonkanRailway.com,,India,,"Konkan Railway Corporation Limited (KRCL) is a Public sector undertakings headquartered at CBD Belapur in Navi Mumbai that operates Konkan Railway and also undertakes other railway-related projects. The railway (railroad) route of KRCL covers the coastal districts of Maharashtra, Goa and Karnataka states of India . The company started its full operations of trains on 26 January 1998.The first passenger train which ran on Konkan railway tracks on 20 March 1993 between Udupi and Mangalore. Konkan Railway Corporation is at the forefront of research and development of new technologies and concepts for Indian railways. During its initial years of operations in the mountainous Konkan region, a spate of accidents prompted Konkan Railway to investigate new technologies. The anti-collision devices, the Sky Bus and RORO are a few of Konkan Railway's innovations.","Konkan Railway Corporation Limited(KRCL) executes other projects for the government of India and state governments. It is one of the contractor for Udampur- Sringar- Baramulla Rail link Project (USBRL) assigned to built a tunnel in that project. KRCL has been selected to prepare Detailed Project Report(DPR) by Kerala state government to built a tunnel to ease traffic congestion on Wayanad- Kozhikode road.
Konkan Railways has played a major role in Construction & Design of Chenab Bridge.
Konkan Railway Corporation Limited(KRCL) completed doubling of tracks from Roha railway station to Veer railway station and Matsyagandha Express train(02619) became first train to travel in down ( LTT to Mangaluru) route of doubled track from Roha to Veer on 30 August 19.35 hours",,,Konkan_Railway_logo.svg,https://en.wikipedia.org/wiki/Konkan_Railway_Corporation
263,U11100DL2015PLC288147,KONKAN LNG LIMITED,Active,RoC-Delhi,288147.0,Public Limited Company,Delhi,Company limited by Shares,Non-govt company,Public,2015-12-04 00:00:00,"6 years, 4 month, 3 days","Extraction of crude petroleum and natural gas [including liquefaction/ regasification of natural gas for purposes of transport and the production, at the mining site, of hydrocarbons from oil or gas field gases ]","₹49,999,999,000","₹9,429,927,900",Unlisted,2020-09-18 00:00:00,2020-03-31 00:00:00,NALINI MALHOTRA,Email ID: nidhigola@gail.co.in,"16, BHIKAIJI CAMA PLACE R. K. PURAM NEW DELHI South Delhi DL 110066 IN","Konkan Lng Limited is a Public incorporated on 04 December 2015. It is classified as Non-govt company and is registered at Registrar of Companies, Delhi. Its authorized share capital is Rs. 49,999,999,000 and its paid up capital is Rs. 9,429,927,900. It is inolved in Extraction of crude petroleum and natural gas [including liquefaction/ regasification of natural gas for purposes of transport and the production, at the mining site, of hydrocarbons from oil or gas field gases ] Konkan Lng Limited's Annual General Meeting (AGM) was last held on 18 September 2020 and as per records from Ministry of Corporate Affairs (MCA), its balance sheet was last filed on 31 March 2020. Directors of Konkan Lng Limited are Nalini Malhotra, Sashi Menon, Mahesh Vishwanathan Iyer, . Konkan Lng Limited's Corporate Identification Number is (CIN) U11100DL2015PLC288147 and its registration number is 288147.Its Email address is nidhigola@gail.co.in and its registered address is 16, BHIKAIJI CAMA PLACE R. K. PURAM NEW DELHI South Delhi DL 110066 IN , - , . Current status of Konkan Lng Limited is - Active.",,,,,,,,,,,,,,,,,,,,,,,,,,,,Public Sector Enterprise,,,India,,,,,,,
264,U45200TG2006PLC051378,KRISHNAPATNAM RAILWAY COMPANY LIMITED,Active,RoC-Hyderabad,51378.0,Public Limited Company,Telangana,Company limited by Shares,Non-govt company,Public,2006-10-11 00:00:00,"15 years, 5 month, 27 days",Building of complete constructions or parts thereof; civil engineering,"₹6,499,999,700","₹6,249,999,900",Unlisted,2020-09-24 00:00:00,2020-03-31 00:00:00,SAJAL MITTRA,Email ID: cstrilokkrcl@gmail.com,"Amsri Faust Complex, Door No D-9-1-164/A to 166, 5th Floor, Sarojini Devi Road Secunderabad TG 500003 IN","Krishnapatnam Railway Company Limited is a Public incorporated on 11 October 2006. It is classified as Non-govt company and is registered at Registrar of Companies, Hyderabad. Its authorized share capital is Rs. 6,499,999,700 and its paid up capital is Rs. 6,249,999,900. It is inolved in Building of complete constructions or parts thereof; civil engineering Krishnapatnam Railway Company Limited's Annual General Meeting (AGM) was last held on 24 September 2020 and as per records from Ministry of Corporate Affairs (MCA), its balance sheet was last filed on 31 March 2020. Directors of Krishnapatnam Railway Company Limited are Sajal Mittra, Alok Kumar Mehta, Venkata Subrahmanyam Dronamraju, Vinay Kumar Prajapati, Shilpi Agarwal, Dilip Kumar Gupta, Kasturi Siva Prasad, Jaya Varma Sinha, . Krishnapatnam Railway Company Limited's Corporate Identification Number is (CIN) U45200TG2006PLC051378 and its registration number is 51378.Its Email address is cstrilokkrcl@gmail.com and its registered address is Amsri Faust Complex, Door No D-9-1-164/A to 166, 5th Floor, Sarojini Devi Road Secunderabad TG 500003 IN , - , . Current status of Krishnapatnam Railway Company Limited is - Active.",,,,,,,,,,,,,,,,,,,,,,,,,,,,Public Sector Enterprise,http://krcl.org.in/,,India,,"The Government of India launched the National Rail Vikas Yojana in December 2002 with the objective of achieving a significant improvement in ‘Rail Transport capacity’ on the congested Golden Quadrilateral and Diagonals and Last Mile Port connectivity. As a part of implementing the Rail Vikas Yojna, a Memorandum of Understanding (MoU) was signed between Ministry of Railways and RVNL on 16th October 2003, for creating Project specific SPVs in Public Private Partnership mode of finance.
Obulavaripalle- Krishnapatnam New Line (Port Connectivity) project was identified by MoR to be executed under NRVY. A MoU was signed on November 22, 2005 between Rail Vikas Nigam Limited (RVNL), Government of Andhra Pradesh and Krishnapatnam Port Company Limited to set up a Joint Venture Company as special purpose vehicle (SPV) to implement the New BG Electrified Rail Line between Obulavaripalle- Krishnapatnam.",,,,,https://en.wikipedia.org/w/index.php?title=Krishnapatnam_Railway_Company_Limited&action=edit&redlink=1
265,U85110KL2008PTC021819,LIFESPRING HOSPITALS PRIVATE LIMITED,Active,RoC-Ernakulam,21819.0,Private Limited Company,Kerala,Company limited by Shares,Non-govt company,Private,2008-02-07 00:00:00,"14 years, 2 month, 0 days",Human health activities,"₹200,000,000","₹171,598,576",Unlisted,2021-09-24 00:00:00,2021-03-31 00:00:00,GEETA SHARMA,Email ID: subramonianh@lifecarehll.com,"HLL Bhavan Mahilamandiram Road, Poojappura Thiruvananthapuram KL 695012 IN","Lifespring Hospitals Private Limited is a Private incorporated on 07 February 2008. It is classified as Non-govt company and is registered at Registrar of Companies, Ernakulam. Its authorized share capital is Rs. 200,000,000 and its paid up capital is Rs. 171,598,576. It is inolved in Human health activities Lifespring Hospitals Private Limited's Annual General Meeting (AGM) was last held on 24 September 2021 and as per records from Ministry of Corporate Affairs (MCA), its balance sheet was last filed on 31 March 2021. Directors of Lifespring Hospitals Private Limited are Geeta Sharma, Mahesh Yagnaraman, Beji Kavumkal George, . Lifespring Hospitals Private Limited's Corporate Identification Number is (CIN) U85110KL2008PTC021819 and its registration number is 21819.Its Email address is subramonianh@lifecarehll.com and its registered address is HLL Bhavan Mahilamandiram Road, Poojappura Thiruvananthapuram KL 695012 IN , - , . Current status of Lifespring Hospitals Private Limited is - Active.",,,,,,,,,,,,,,,,,,,,,,,,,,,,Public Sector Enterprise,https://www.lifespring.in/briefly.html,,India,,,,,,,https://en.wikipedia.org/w/index.php?title=Life_Spring_Hospitals_(P)_Ltd.&action=edit&redlink=1
266,L32201TN1966GOI005469,MADRAS FERTILIZERS LIMITED,Active,RoC-Chennai,5469.0,Companies owned by the Government of India,Tamil Nadu,Company limited by Shares,Union Govt company,Public,1966-12-08 00:00:00,"55 years, 3 month, 30 days",Manufacture of television and radio transmitters and apparatus for line telephony and line telegraphy,"₹3,649,999,870","₹1,611,012,990",Listed,2020-12-29 00:00:00,2020-03-31 00:00:00,MOHAMMAD BAGHER DAKHILI,Email ID: cs@madrasfert.co.in,MANALI MADRAS TN 600068 IN,"Madras Fertilizers Limited is a Public incorporated on 08 December 1966. It is classified as Union Govt company and is registered at Registrar of Companies, Chennai. Its authorized share capital is Rs. 3,649,999,870 and its paid up capital is Rs. 1,611,012,990. It is inolved in Manufacture of television and radio transmitters and apparatus for line telephony and line telegraphy Madras Fertilizers Limited's Annual General Meeting (AGM) was last held on 29 December 2020 and as per records from Ministry of Corporate Affairs (MCA), its balance sheet was last filed on 31 March 2020. Directors of Madras Fertilizers Limited are Mohammad Bagher Dakhili, Harsh Malhotra, Ulaganathan Saravanan, Siya Sharan, Samieh Kokabi, . Madras Fertilizers Limited's Corporate Identification Number is (CIN) L32201TN1966GOI005469 and its registration number is 5469.Its Email address is cs@madrasfert.co.in and its registered address is MANALI MADRAS TN 600068 IN , - , . Current status of Madras Fertilizers Limited is - Active.",,,"Fertilizers
Agrochemical",,"Manali, Chennai, India",,,,,,,,,,,,,,,,,,,,"BSE: 532168
NSE: MADRASFERT","U Saravanan, Chairman and MD",,Public Sector Enterprise,www.madrasfert.co.in,,India,"Ministry of Chemicals and Fertilizers, Government of India","Madras Fertilizers Limited (MFL) was incorporated in December 1966 as a joint venture between GOI and AMOCO India Incorporation of USA (AMOCO) with GOI holding 51% of the equity share capital. The company is engaged in the manufacture of ammonia, urea and complex fertilizers at Manali, Chennai. The company is the first Public Sector Undertaking in the Fertilizer industry to get the ISO 9002 certification.",,532168.0,MADRASFERT,,https://en.wikipedia.org/wiki/Madras_Fertilizers
