,CIN,Company Name,Company Status,RoC,reg_number,Ownership,State,Company Category,Company Sub Category,Class of Company,Date of Incorporation,Age of Company,Activity,Authorised Capital,Paid up capital,Listing status,Date of Last Annual General Meeting,Date of Latest Balance Sheet,Director Name,Email ID,Address,description,Products,Capital ratio,Industry,Headquarters,Founded,Location,Predecessor,Areas served,Operating income,Founder,Total assets,Services,Native name,Total equity,Parent,Production output,Subsidiaries,Revenue,Divisions,Dam volume,Formerly,Parent organisation,ISIN,Number of employees,Traded as,Key people,Net income,Type,Website,Number of locations,Country,Owner,new history eng,operations eng,BSE_code,NSE_code,logo,wiki_url
0,L74899DL1964GOI004281,BHARAT HEAVY ELECTRICALS LIMITED,Active,RoC-Delhi,4281.0,Companies owned by the Government of India,Delhi,Company limited by Shares,Union Govt company,Public,1964-11-13 00:00:00,"57 years, 4 month, 24 days",OTHER BUSINESS ACTIVITIES,"₹20,000,000,000","₹6,964,126,700",Listed,2020-09-28 00:00:00,2020-03-31 00:00:00,SUBODH GUPTA,Email ID: companysecretary@bhel.in,BHEL HOUSE SIRI FORT NEW DELHI DL 110049 IN,"Bharat Heavy Electricals Limited is a Public incorporated on 13 November 1964. It is classified as Union Govt company and is registered at Registrar of Companies, Delhi. Its authorized share capital is Rs. 20,000,000,000 and its paid up capital is Rs. 6,964,126,700. It is inolved in OTHER BUSINESS ACTIVITIES Bharat Heavy Electricals Limited's Annual General Meeting (AGM) was last held on 28 September 2020 and as per records from Ministry of Corporate Affairs (MCA), its balance sheet was last filed on 31 March 2020. Directors of Bharat Heavy Electricals Limited are Subodh Gupta, Kamalesh Das, Manish Kapoor, Raj Kumar Agarwal, . Bharat Heavy Electricals Limited's Corporate Identification Number is (CIN) L74899DL1964GOI004281 and its registration number is 4281.Its Email address is companysecretary@బి.హెచ్.ఈ.ఎల్.in and its registered address is బి.హెచ్.ఈ.ఎల్ HOUSE SIRI FORT NEW DELHI DL 110049 IN , - , . Current status of Bharat Heavy Electricals Limited is - Active.","Gas and Steam Turbines
Boilers
Electric Motors
Electric Locomotives
Generators
Heat Exchangers
Switchgears and Sensors
Automation and Control Systems
Power electronics
Transmission systems",,Electrical equipment,"New Delhi, India",1956; 66 years ago,,,,,,"₹60,784.32 crore (US$8.0 billion) (2020)",,,"₹28,651.65 crore (US$3.8 billion) (2020)","Ministry of Heavy Industries , Government of India",,,"₹22,066.64 crore (US$2.9 billion) (2020)",,,,,INE257A01026,"31,708(March 2021)","BSE: 500103
NSE: BHEL","Nalin Shinghal
(Chairman & Managing Director)",,Public Sector Enterprise,www.bhel.com,"31,708(March 2021)",India,Government of India (63.17%),"BHEL was established in 1956 ushering in the Heavy Electrical Equipment industry in India. Heavy Electricals (India) Limited was merged with BHEL in 1974. When it was set up in 1956, BHEL was envisaged as a plain manufacturing PSU, with technological help from the Soviet Union. In 1980's it was cutting edge in thyristor technology. In 1991, BHEL was converted into a public company. Over time, it developed the capability to produce a variety of electrical, electronic, and mechanical equipment for various sectors, including transmission, transportation, oil and gas, and other allied industries. However, the bulk of the company's revenue is still derived from the sale of power generation equipment such as turbines and boilers. As of 2017, equipment supplied by BHEL constituted around 55% of the total installed power generation capacity in India. The company also supplies electric locomotives to the Indian Railways and defence equipment such as the Super Rapid Gun Mount (SRGM) naval guns manufactured in partnership with the Ordnance Factory Board and simulators to the Indian Armed Forces.","BHEL-built 6,000 HP electric locomotive WAG9H. It is equipped with state-of-the-art Insulated Gate Bipolar Transistors (IGBT) based 3-phase propulsion system with regenerative braking system.
Two-seat training monoplane Bharat Swati built by BHEL
Super Rapid Gun Mount (SRGM) 76/62 naval gun built by BHEL
BHEL is engaged in the design, engineering, manufacturing, construction, testing, commissioning and servicing of a wide range of products, systems and services for the core sectors of the economy, viz. power, transmission, industry, transportation, renewable energy, oil & gas, and defence.
It has a network of 16 manufacturing units, 2 repair units, 4 regional offices, 8 service centres, 8 overseas offices, 15 regional centres, 7 joint ventures, and infrastructure allowing it to execute more than 150 projects at sites across India and abroad. The company has established the capability to deliver 20,000 MW p.a. of power equipment to address the growing demand for power generation equipment.
BHEL has retained its market leadership position during 2015–16 with 74% market share in the Power Sector. An improved focus on project execution enabled BHEL record its highest ever commissioning/synchronization of 15059 MW of power plants in domestic and international markets in 2015–16, marking a 59% increase over 2014–15. With the all-time high commissioning of 15000 MW in a single year FY2015-16, BHEL has exceeded 170 GW installed base of power generating equipments.
It also has been exporting its power and industry segment products and services for over 40 years. BHEL's global references are spread across over 76 countries across all the six continents of the world. The cumulative overseas installed capacity of BHEL manufactured power plants exceeds 9,000 MW across 21 countries including Malaysia, Oman, Iraq, UAE, Bhutan, Egypt, and New Zealand. Their physical exports range from turnkey projects to after sales services.",500103.0,BHEL,BHEL_logo.svg,https://en.wikipedia.org/wiki/Bharat_Heavy_Electricals_Limited
1,L23220MH1952GOI008931,BHARAT PETROLEUM CORPORATION LIMITED,Active,RoC-Mumbai,8931.0,Companies owned by the Government of India,Maharashtra,Company limited by Shares,Union Govt company,Public,1952-11-03 00:00:00,"69 years, 5 month, 4 days",Manufacture of refined petroleum products,"₹26,350,000,100","₹21,692,526,600",Listed,2021-09-27 00:00:00,2021-03-31 00:00:00,GOPAL KRISHAN AGARWAL,Email ID: dixitns@bharatpetroleum.in,BHARAT BHAWAN BALLARD ESTATE MUMBAI MH 400001 IN,"Bharat Petroleum Corporation Limited is a Public incorporated on 03 November 1952. It is classified as Union Govt company and is registered at Registrar of Companies, Mumbai. Its authorized share capital is Rs. 26,350,000,100 and its paid up capital is Rs. 21,692,526,600. It is inolved in Manufacture of refined petroleum products Bharat Petroleum Corporation Limited's Annual General Meeting (AGM) was last held on 27 September 2021 and as per records from Ministry of Corporate Affairs (MCA), its balance sheet was last filed on 31 March 2021. Directors of Bharat Petroleum Corporation Limited are Gopal Krishan Agarwal, Ramakrishna Gupta Vetsa, Aiswarya Biswal, Ghanshyam Sher, Suman Billa, Pradeep Vishambhar Agrawal, . Bharat Petroleum Corporation Limited's Corporate Identification Number is (CIN) L23220MH1952GOI008931 and its registration number is 8931.Its Email address is dixitns@bharatpetroleum.in and its registered address is BHARAT BHAWAN BALLARD ESTATE MUMBAI MH 400001 IN , - , . Current status of Bharat Petroleum Corporation Limited is - Active.","Petroleum
Natural gas
LNG
Lubricants
Petrochemicals",,Energy: Oil and gas,"Mumbai, Maharashtra, India",,,,,,,"₹140,604 crore (US$18 billion) (2021)",,,,"Ministry of Petroleum and Natural Gas
(Government of India)",,,"₹300,830 crore (US$39 billion) (2021)","Bharat Oman Refinery Limited
Bharat Petroresources Limited
Bharat Gas Resources Limited
Bharat Renewable Energy Limited",,,,INE029A01011,9257 (March 2021),"BSE: 500547
NSE: BPCL
NSE NIFTY 50 Constituent","Arun Kumar Singh
(Chairman & MD)","₹19,042 crore (US$2.5 billion) (2021)",Public Sector Enterprise,www.bharatpetroleum.com,,India,Government of India (52.98%),"The company today known as BPCL started off as Rangoon Oil and Exploration company set up to explore the new discoveries off Assam and Burma during the British colonial rule of India. In 1889 during vast industrial development, an important player in the South Asian market was the Burmah Oil Company. Though incorporated in Scotland in 1886, the company grew out of the enterprises of the Chef Rohit Oil Company, which had been formed in 1871 to refine crude oil produced from primitive hand dug wells in Upper Burma.
In 1928, Asiatic Petroleum Company (India) started cooperation with Burma oil company. Asiatic Petroleum was a joint venture of Royal Dutch, Shell and Rothschilds formed to address the monopoly of John D Rockefeller's Standard Oil, which also operated in India as Esso. This alliance led to the formation of Burmah-Shell Oil Storage and Distributing Company of India Limited. Burmah Shell began its operations with import and marketing of Kerosene.
In the mid 1950s, the company began to sell LPG cylinders to homes in India and further expanded its delivery network. It also marketed kerosene, diesel and petrol in cans in order to reach remote parts of India. In 1951, the Burmah shell began to build a refinery in Trombay (Mahul, Maharashtra) under an agreement with the Government of India.","Bharat Petroleum operates the following refineries:
Mumbai Refinery : Located near Mumbai, Maharashtra. It has a capacity of 13 million metric tonnes per annum.
Kochi Refinery : Located near Kochi, Kerala. It has a capacity of 15.5 million metric tonnes per annum.
Bina Refinery : Located near Bina, Sagar district, Madhya Pradesh. It has a capacity of 7.8 million metric tonnes per year. This refinery started as Bharat Oman Refineries Limited (BORL), a joint venture between Bharat Petroleum and OQ (formerly known as Oman Oil Company). Incorporated in 1994, BORL also has single point mooring (SPM) system, crude oil terminal (COT) and a 937km-long cross-country crude oil pipeline from Vadinar, Gujarat to Bina, Madhya Pradesh. As of April 2021, BORL is a subsidiary of BPCL.
Numaligarh Refinery : Located near Numaligarh, Golaghat district, Assam. It has a capacity of 3 million metric tonnes per year.(Sold to consortium led by Oil India Ltd.)
The company business is divided in seven SBUs( Strategic Business Units), like Retail, Lubricants, Aviation, Refinery, Gas, I&C and LPG.",500547.0,BPCL,Bharat_Petroleum_Logo.svg,https://en.wikipedia.org/wiki/Bharat_Petroleum_Corporation_Limited
2,L23109WB1973GOI028844,COAL INDIA LTD,Active,RoC-Kolkata,28844.0,Companies owned by the Government of India,West Bengal,Company limited by Shares,Union Govt company,Public,1973-06-14 00:00:00,"48 years, 9 month, 23 days","Manufacture of coke oven products [This class includes the operation of coke ovens chiefly for the production of coke or semi -coke from hard coal and lignite, retort carbon and residual products such as coal tar or pitch. Agglomeration of coke. Distillation of coal tar is classified in class 2411.]","₹89,041,797,000","₹61,627,281,000",Listed,2021-09-15 00:00:00,2021-03-31 00:00:00,VINAY RANJAN,Email ID: MVISWANATHAN2.CIL@COALINDIA.IN,"COAL BHAWAN, PREMISES NO-04-MAR, PLOT-AF-III ACTION AREA-1A, NEW TOWN RAJARHAT KOLKATA Kolkata WB 700156 IN","Coal India Ltd Govt Of India Undertaking is a Public incorporated on 14 June 1973. It is classified as Union Govt company and is registered at Registrar of Companies, Kolkata. Its authorized share capital is Rs. 89,041,797,000 and its paid up capital is Rs. 61,627,281,000. It is inolved in Manufacture of coke oven products [This class includes the operation of coke ovens chiefly for the production of coke or semi -coke from hard coal and lignite, retort carbon and residual products such as coal tar or pitch. Agglomeration of coke. Distillation of coal tar is classified in class 2411.] Coal India Ltd Govt Of India Undertaking's Annual General Meeting (AGM) was last held on 15 September 2021 and as per records from Ministry of Corporate Affairs (MCA), its balance sheet was last filed on 31 March 2021. Directors of Coal India Ltd Govt Of India Undertaking are Vinay Ranjan, Pramod Agrawal, Binay Dayal, Bhojarajan Rajesh Chander, Vinod Kumar Tiwari, . Coal India Ltd Govt Of India Undertaking's Corporate Identification Number is (CIN) L23109WB1973GOI028844 and its registration number is 28844.Its Email address is MVISWANATHAN2.CIL@COALINDIA.IN and its registered address is COAL BHAWAN, PREMISES NO-04-MAR, PLOT-AF-III ACTION AREA-1A, NEW TOWN RAJARHAT KOLKATA Kolkata WB 700156 IN , - , . Current status of Coal India Ltd Govt Of India Undertaking is - Active.",Coal,,"Mining, Refinery","Kolkata, West Bengal, India",1975; 47 years ago,,,India,"₹18,656 crore (US$2.4 billion) (2021)",,"₹161,779 crore (US$21 billion) (2021)",,कोल इंडिया लिमिटेड,"₹30,354 crore (US$4.0 billion) (2021)","Ministry of Coal, Government of India",,,"₹93,818 crore (US$12 billion) (2021)",,,,,INE522F01014,"272,445 (2021)","BSE: 533278
NSE: COALINDIA
NSE NIFTY 50 Constituent","Pramod Agarwal
(Chairman & MD)","₹12,705 crore (US$1.7 billion) (2021)",Public Sector Enterprise,www.coalindia.in,,India,Government of India (66.13%),"Coal mining in India had primarily been a private sector enterprise. This changed in September 1956 when the Government of India established its own coal company National Coal Development Corporation (NCDC). Collieries run by the Railways formed the nucleus of NCDC. This was to fulfill the fast growing energy requirements in the country to support rapid industrialization taking place through Five-Year Plans of the Government. In the same year, Singareni Colliery Company, which was operating in Andhra Pradesh since 1920, was also brought under the Government control when the Central Government and state Government of Andhra Pradesh acquired 45% and 55% shares respectively.
In 1971, the Government of India nationalized all the 214 coking-coal mines and 12 coke-ovens running in the private sector, excluding those held by TISCO and IISCO for their captive use. On 1 January 1972, a new Government company Bharat Coking Coal Limited (BCCL) was formed to take control of these nationalized mines and coke-ovens. On 30 January 1973, all the remaining 711 non-coking coalmines of the country in private sector were also nationalized. 184 of these mines were handed over to BCCL, and remaining 527 were handed over to a newly opened department Coal Mines Authority. 4 months later, on 14 June 1973, this department was converted into a separate Government company CMAL. NCDC, earlier formed in 1957, was merged with CMAL, and 45% share-holding of Central Government in Singareni Collieries Company Ltd was also handed over to CMAL. CMAL started functioning with its 4 divisions, viz, Eastern Coalfields, Central Coalfields, Western Coalfields, and Central Mine Planning and Design Institute.
By 1973, all coking coalmines were under BCCL, which was functioning as a subsidiary of Steel Authority of India (SAIL) under Department of Steel of the Ministry of Steel and Mines; and all non-coking coalmines were under CMAL, which was under Department of Mines of the Ministry of Steel and Mines. For better control, both BCCL and CMAL were brought on 11 October 1974 under the Department of Coal (now an independent Ministry) of the newly formed Ministry of Energy.
On 1 November 1975, a new public-sector company Coal India Limited (CIL) was formed to enable better organizational and operational efficiency in coal sector. All the 4 Divisions of CMAL were given the company status, and were brought under CIL along with BCCL. 45% share-holding of the CMAL in Singareni Collieries Company was also transferred to CIL, and CMAL was closed.
Thus, CIL started functioning in 1975 with 5 subsidiary companies under it. These were Bharat Coking Coal Limited (BCCL), Eastern Coalfields Limited (ECL), Central Coalfields Limited (CCL), Western Coalfields Limited (WCL), and Central Mine Planning & Design Institute Limited (CMPDIL). In due course of time, 3 more companies were formed under CIL by carving out certain areas of CCL and WCL. These were Northern Coalfields Limited (NCL), South-Eastern Coalfields Limited (SECL), and Mahanadi Coalfields Limited (MCL).
Pursuant to the Fuel Policy of 1974, CIL also started the construction of India's First Low Temperature Carbonisation Plant at Dankuni in the late 1970s. It was renamed as Dankuni Coal Complex, and is one of the only operational Coal gas plant of this kind in the world. Dankuni Coal Complex has been incurring heavy loss due to the Greater Calcutta Gas Supply Company (formerly known as Oriental Gas Co.) giving non-remunerative price and fixing them unilaterally. Coal India is planning to venture into Coal-to-Methanol technology at the existing Plant.
The Government of India held 100% equity of CIL from 1975 till 2010.","CIL is the largest coal producing company in the world. It produced 536.51 MT (million tonne) coal during FY 2015–16. Coal India operates through 83 mining areas in 8 states of India. As on 1 April 2015, it has 430 coal mines out of which 175 are open cast, 227 are underground and 28 are mixed mines. Production from open cast mines during FY 2014–15 was 92.91% of total production of 494.24 MT. Underground mines contributed to 7.09% of production. CIL further operates 15 coal washeries, out of which 12 are for coking coal and 3 are for non-coking coal with 23.30 MTY and 13.50 MTY capacities respectively. CIL's only Low Temperature Carbonisation Plant of Dankuni Coal Complex is currently run on lease basis by its subsidiary SECL. In addition to above, it also manages 200 other establishments like workshops, hospitals, training institutes, mine-rescue setups, etc.",533278.0,COALINDIA,Coal_India_Logo.svg,https://en.wikipedia.org/wiki/Coal_India
3,L40200DL1984GOI018976,GAIL (INDIA) LIMITED,Active,RoC-Delhi,18976.0,Companies owned by the Government of India,Delhi,Company limited by Shares,Union Govt company,Public,1984-08-16 00:00:00,"37 years, 7 month, 22 days",Manufacture of gas; distribution of gaseous fuels through mains,"₹49,999,999,000","₹44,403,851,000",Listed,2021-09-09 00:00:00,2021-03-31 00:00:00,RANGANATHAN ELAVATHUR SUBRAMANIA,Email ID: ak.jha2@gail.co.in,16 BHIKAIJI CAMA PLACE R K PURAM NEW DELHI DL 110066 IN,,"Natural gas, petrochemical, liquid hydrocarbons, Liquefied petroleum gas transmission, Renewable Energy including Solar & Wind, city gas distribution, E&P, electricity generation",,Energy,"New Delhi, India",1984; 38 years ago,,,,,,"₹81,384 crore (US$11 billion)  (2021)",,,"₹53,182 crore (US$7.0 billion)  (2021)","Ministry of Petroleum and Natural Gas, Government of India",,,"₹58,492 crore (US$7.7 billion)  (2021)",,,Gas Authority of India Limited,,INE129A01019,4682 (2020),"BSE: 532155
NSE: GAIL
LSE: GAID
NSE NIFTY 50 Constituent","Manoj Jain ,
(Chairman & MD)","₹7,469 crore (US$980 million)  (2021)",Public Sector Enterprise,gailonline.com,,India,Government of India (51.83%),"GAIL (India) Limited was incorporated in August 1984 as a Central Public Sector Undertaking (PSU) under the Ministry of Petroleum & Natural Gas (MoP&NG). The company was formerly known as Gas Authority of India Limited. It is India's principal gas transmission and marketing company. The company was initially given the responsibility of construction, operation and maintenance of the Hazira – Vijaypur – Jagdishpur (HVJ) pipeline project. It was one of the largest cross-country natural gas pipeline projects in the world. This 1750-kilometre-long pipeline was built at a cost of ₹17 billion (US$220 million) and it laid the foundation for development of market for natural gas in India. GAIL commissioned the 1,750 kilometres (1,090 mi) Hazira-Vijaipur-Jagdishpur (HVJ) pipeline in 1991. Between 1991 and 1993, three liquefied petroleum gas (LPG) plants were constructed and some regional pipelines acquired, enabling GAIL to begin its gas transportation in various parts of India.
GAIL began its city gas distribution in New Delhi in 1997 by setting up nine compressed natural gas (CNG) stations.
In order to secure gas for its mainstream business, the Exploration and Production department was created. Today GAIL is a partner in the Daewoo-OVL led consortium in two offshore blocks in Myanmar which have made a gas discovery. The bulk of its blocks are located in India in the prolific basins of Cambay, Assam-Arakan, Mahanadi, Krishna Godavary deep water and onland, Cauvery onland and deep water and western offshore. It is actively scouting for foreign blocks both exploratory or discovery.
GAIL today has reached new milestones with its strategic diversification into petrochemicals, telecom and liquid hydrocarbons besides gas infrastructure. The company has also extended its presence in power, liquefied natural gas re-gasification, city gas distribution and exploration & production through participation in equity and joint ventures. Incorporating the new-found energy into its corporate identity, Gas Authority of India was renamed GAIL (India) Limited on 22 November 2002.
GAIL (India) Limited has shown organic growth in gas transmission through the years by building large network of trunk pipelines covering length of around 10,700 kilometres (6,600 mi). Leveraging on the core competencies, GAIL played a key role as gas market developer in India for decades catering to major industrial sectors like power, fertilizers, and city gas distribution. GAIL transmits more than 160 million cubic metre per day at standard conditions of gas through its dedicated pipelines and have more than 70% market share in both gas transmission and marketing.","GAIL has built a network of trunk pipelines covering the length of around 13722 km. Leveraging on the core competencies, GAIL played a key role as gas market developer in India for decades catering to major industrial sectors like power, fertilizers, and city gas distribution. GAIL transmits more than 160 million cubic metre per day at standard conditions of gas through its dedicated pipelines and have more than a 70% market share in both gas transmission and marketing. GAIL’s existing natural gas pipeline network covers 20 States (Andhra Pradesh, Assam, Bihar, Delhi, Goa, Gujarat, Haryana, Himachal Pradesh,Jharkhand, Karnataka, Kerala, Maharashtra, Madhya Pradesh, Punjab, Rajasthan, Tamil Nadu, Tripura, Uttar Pradesh Uttarakhand and West Bengal) and 2 UT’s ( Puducherry & Dadra Nagar Haveli).",532155.0,GAIL,GAIL.svg,https://en.wikipedia.org/wiki/GAIL
