170,U51100MH2005PLC153384,NATIONAL SPOT EXCHANGE LIMITED,Active,RoC-Mumbai,153384.0,Public Limited Company,Maharashtra,Company limited by Shares,Non-govt company,Public,2005-05-18 00:00:00,"16 years, 10 month, 20 days","Wholesale on a fee or contract basis. [Includes commission agents, commodity brokers and auctioneers and all other wholesalers who trade on behalf and on the account of others. Activities of self employed auctioneers are included in 74991.]","₹3,000,000,000","₹2,444,790,530",Unlisted,2021-09-15 00:00:00,2021-03-31 00:00:00,BIPIN MOHANLAL DHANESHA,Email ID: ls@nationalspotexchange.com,"Malkani Chambers Condominium, 1st Floor, Off. Nehru Road,Near Hotel Orchid, Ville Parle (E) Mumbai Mumbai City MH 400099 IN","National Spot Exchange Limited is a Public incorporated on 18 May 2005. It is classified as Non-govt company and is registered at Registrar of Companies, Mumbai. Its authorized share capital is Rs. 3,000,000,000 and its paid up capital is Rs. 2,444,790,530. It is inolved in Wholesale on a fee or contract basis. [Includes commission agents, commodity brokers and auctioneers and all other wholesalers who trade on behalf and on the account of others. Activities of self employed auctioneers are included in 74991.] National Spot Exchange Limited's Annual General Meeting (AGM) was last held on 15 September 2021 and as per records from Ministry of Corporate Affairs (MCA), its balance sheet was last filed on 31 March 2021. Directors of National Spot Exchange Limited are Bipin Mohanlal Dhanesha, Ashok Kumar Nag, Subramanya Kusnur, Neeraj Sharma, Vijay Ramakrishnan, Ujjwala Hemant Deshpande, . National Spot Exchange Limited's Corporate Identification Number is (CIN) U51100MH2005PLC153384 and its registration number is 153384.Its Email address is ls@nationalspotexchange.com and its registered address is Malkani Chambers Condominium, 1st Floor, Off. Nehru Road,Near Hotel Orchid, Ville Parle (E) Mumbai Mumbai City MH 400099 IN , - , . Current status of National Spot Exchange Limited is - Active.",Spot exchange,,Commodity Spot Trading,"Mumbai, India",2008,,,,,,,,,,,,,,,,,,,,,,,Public Sector Enterprise,www.nationalspotexchange.com,,India,"Ministry of Finance, Government of India","The National Spot Exchange Limited (NSEL) is India's first spot exchange that was established in view of the then Prime Minister's vision to create a ""single market"" across the country for both manufactured and agricultural produce. The Economic Survey of 2002-03 of the Government of India also recommended setting up a national-level, integrated market for agricultural products, as did the Planning Commission. This was followed by the Rangarajan Committee, which too sought a national spot market. It is under the ownership of Ministry of Finance, Government of India. The Government of India granted permission to NSEL along with two other spot exchanges to start operations. The Government of India issued a Gazette Notification dated 5 June 2007 granted general exemption under Section 27 of the Forward Contracts Regulation Act (FCRA.)","NSEL commenced operations providing an electronic trading platform in October 2008 and simultaneously, as many as six state governments issued licenses under the model Agricultural Produce Market Committees (APMC) Act to NSEL. In August 2011, the Forward Markets Commission (FMC) was appointed as the 'designated agency' to regulate these spot exchanges.",,,,https://en.wikipedia.org/wiki/National_Spot_Exchange
171,U74999MH2005PLC157556,INTER-CONNECTED ENTERPRISES LIMITED,Active,RoC-Mumbai,157556.0,Public Limited Company,Maharashtra,Company limited by Shares,Non-govt company,Public,2005-11-24 00:00:00,"16 years, 4 month, 13 days",Business activities n.e.c.,"₹100,000,000","₹46,410,376",Unlisted,2020-12-07 00:00:00,2020-03-31 00:00:00,VALLIAPPAN NAGAPPAN,Email ID: icelshareholders@gmail.com,INTERNATIONAL INFOTECH PARKTOWER 7 5TH FLOOR VASHI NAVI MUMBAI MH 400703 IN,"Inter-connected Enterprises Limited is a Public incorporated on 24 November 2005. It is classified as Non-govt company and is registered at Registrar of Companies, Mumbai. Its authorized share capital is Rs. 100,000,000 and its paid up capital is Rs. 46,410,376. It is inolved in Business activities n.e.c. Inter-connected Enterprises Limited's Annual General Meeting (AGM) was last held on 07 December 2020 and as per records from Ministry of Corporate Affairs (MCA), its balance sheet was last filed on 31 March 2020. Directors of Inter-connected Enterprises Limited are Valliappan Nagappan, Peter Markose, Rajeeb Ranjan Kumar, Ashok Anopchand Lunia, Shrichand Pareek, Gnanavel Sendhivel, Swaminathan, Raghavan Mukkur Srinivasan, . Inter-connected Enterprises Limited's Corporate Identification Number is (CIN) U74999MH2005PLC157556 and its registration number is 157556.Its Email address is icelshareholders@gmail.com and its registered address is INTERNATIONAL INFOTECH PARKTOWER 7 5TH FLOOR VASHI NAVI MUMBAI MH 400703 IN , - , . Current status of Inter-connected Enterprises Limited is - Active.",,,,,1998,"Mumbai, India",,,,,,,,,,,,,,,,,,,,,,Public Sector Enterprise,www.iseindia.com,,India,Government of India,"At a meeting of the Federation of Indian Stock Exchanges held in October 1996, a steering committee was formed to evolve an Inter-Connected Market System. As a result, Inter-connected Stock Exchange (ISE), which was promoted by 14 regional stock exchanges of the country (excluding Calcutta, Delhi, Ahmedabad, Ludhiana and Pune Stock Exchange, apart from NSE, BSE and OTCEI) was incorporated by SEBI under the Securities Contracts (Regulations) Act, 1956 on 18 November 1998, ISE commenced trading on 26 February 1999.","Inter-connected Stock Exchange is a Depository Participant of Central Depository Service (India) Limited (CDSL) and National Securities Depository Limited (NSDL). ISE-DP has branches at Delhi, Kolkata, Patna, Guwahati, Ahmedabad, Hyderabad, Nagpur, Coimbatore, Tirunelveli and 155 Collection Centers across the country.",,,National_Spot_Exchange_%28logo%29.gif,https://en.wikipedia.org/wiki/Inter-connected_Stock_Exchange_of_India
172,U65999MH2008PLC185856,METROPOLITAN STOCK EXCHANGE OF INDIA LIMITED,Active,RoC-Mumbai,185856.0,Public Limited Company,Maharashtra,Company limited by Shares,Non-govt company,Public,2008-08-14 00:00:00,"13 years, 7 month, 24 days",Other financial intermediation. [This group includes financial intermediation other than that conducted by monetary institutions.],"₹5,500,000,300","₹4,810,217,000",Unlisted,2020-12-18 00:00:00,2020-03-31 00:00:00,TRISHNA GUHA,Email ID: secretarial@msei.in,"205(A), 2nd floor, Piramal Agastya Corporate Park Kamani Junction, LBS Road, Kurla (West), Mumbai Mumbai City MH 400070 IN","Metropolitan Stock Exchange Of India Limited is a Public incorporated on 14 August 2008. It is classified as Non-govt company and is registered at Registrar of Companies, Mumbai. Its authorized share capital is Rs. 5,500,000,300 and its paid up capital is Rs. 4,810,217,000. It is inolved in Other financial intermediation. [This group includes financial intermediation other than that conducted by monetary institutions.] Metropolitan Stock Exchange Of India Limited's Annual General Meeting (AGM) was last held on 18 December 2020 and as per records from Ministry of Corporate Affairs (MCA), its balance sheet was last filed on 31 March 2020. Directors of Metropolitan Stock Exchange Of India Limited are Trishna Guha, Latika Sarabjit Kundu, Vijay Sardana, Sonti Venkata Durga Nageswara Rao, . Metropolitan Stock Exchange Of India Limited's Corporate Identification Number is (CIN) U65999MH2008PLC185856 and its registration number is 185856.Its Email address is secretarial@msei.in and its registered address is 205(A), 2nd floor, Piramal Agastya Corporate Park Kamani Junction, LBS Road, Kurla (West), Mumbai Mumbai City MH 400070 IN , - , . Current status of Metropolitan Stock Exchange Of India Limited is - Active.",,,,,2008,"205 (A), 2nd Floor, Piramal Agastya Corporate Park, Kamani Junction, L.B.S Road, Kurla West, Mumbai, India",,,,,,,,,,,,,,,,,,,,"Latika S Kundu (MD & CEO)
Dinesh Kumar Mehrotra (Chairman, Public Interest Director)",,Public Sector Enterprise,https://www.msei.in/,,India,Government of India,"Metropolitan Clearing Corporation of India Ltd. (MCCIL), was jointly promoted by Metropolitan Stock Exchange of India Ltd. (MSE), Multi-Commodity Exchange of India Limited (MCX) and Financial Technologies India Limited (FTIL), as a new age Clearing Corporation constituted to undertake clearing and settlement of deals in multi asset classes.
The company was incorporated on 7 November 2008 and was permitted by SEBI to undertake clearing and settlement functions of trades done in MSE on 2 January 2009. The company commenced its operations on 16 February 2009.",,,,,https://en.wikipedia.org/wiki/Metropolitan_Stock_Exchange
173,L51909MH2002PLC135594,Multi Commodity Exchange,Active,RoC-Mumbai,135594.0,Public Limited Company,Maharashtra,Company limited by Shares,Non-govt company,Public,2002-04-19 00:00:00,"19 years, 11 month, 29 days",Other wholesale [Includes specialized wholesale not covered in any one of the previous categories and wholesale in a variety of goods without any particular specialization.],"₹700,000,000","₹509,983,680",Listed,2020-08-31 00:00:00,2020-04-01 00:00:00,PRAVIN TRIPATHI,Email ID: mcx.secretarial@gmail.com,"EXCHANGE SQUARE,CHAKALA, SUREN ROAD, ANDHERI (EAST) MUMBAI MH 400093 IN","Multi Commodity Exchange Of India Limited is a Public incorporated on 19 April 2002. It is classified as Non-govt company and is registered at Registrar of Companies, Mumbai. Its authorized share capital is Rs. 700,000,000 and its paid up capital is Rs. 509,983,680. It is inolved in Other wholesale [Includes specialized wholesale not covered in any one of the previous categories and wholesale in a variety of goods without any particular specialization.] Multi Commodity Exchange Of India Limited's Annual General Meeting (AGM) was last held on 31 August 2020 and as per records from Ministry of Corporate Affairs (MCA), its balance sheet was last filed on 31 March 2020. Directors of Multi Commodity Exchange Of India Limited are . Multi Commodity Exchange Of India Limited's Corporate Identification Number is (CIN) L51909MH2002PLC135594 and its registration number is 135594.Its Email address is mcx.secretarial@gmail.com and its registered address is EXCHANGE SQUARE,CHAKALA, SUREN ROAD, ANDHERI (EAST) MUMBAI MH 400093 IN , - , . Current status of Multi Commodity Exchange Of India Limited is - Active.",Commodity Derivatives,,Commodity Exchange,"Mumbai, India",2003-11-10 00:00:00,,,,,,,,,,,,,,,,,,,,BSE: 534091,"Saurabh Chandra
(Chairman)
P S Reddy
(MD & CEO)",,Public Sector Enterprise,www.mcxindia.com,,India,"Ministry of Finance , Government of India","Multi Commodity Exchange of India Ltd (MCX) (BSE: 534091) is a commodity exchange based in India. It is under the ownership of Ministry of Finance , Government of India. It was established in 2003 by the Government of India and is currently based in Mumbai . It is India's largest commodity derivatives exchange. The average daily turnover of commodity futures contracts increased by 26% to ₹32,424 crore during FY2019-20, as against ₹25,648 crore in FY2018-19. The total turnover of commodity futures traded on the Exchange stood at ₹83.98 lakh crore in FY2019-20. MCX offers options trading in gold and futures trading in non-ferrous metals, bullion, energy, and a number of agricultural commodities (mentha oil, cardamom, crude palm oil, cotton, and others).","Commodities traded include -
Metal - Aluminium, Copper, Lead, Nickel, Zinc
Bullion - Gold, Gold Mini, Gold Guinea, Gold Petal, Gold Petal ( New Delhi), Gold Global, Silver, Silver Mini, Silver Micro, Silver 1000.
Agro Commodities - Cardamom, Cotton, Crude Palm Oil, Kapas, Mentha Oil, Castor seed, RBD Palmolien, Black Pepper.
Energy - Crude Oil, Natural Gas.
The efforts that started in the fourth quarter of FY 2018-19 to migrate to 'Compulsory Delivery-based' contracts in all base metals were successfully completed in FY 2019-20. The launch of indigenously benchmarked deliverable futures contracts of Copper, Aluminium, Zinc, Lead and Nickel on MCX, has paved the way for the Indian market prices for metals to be discovered on an exchange platform in a transparent manner.",534091.0,,,https://en.wikipedia.org/wiki/Multi_Commodity_Exchange
174,U51909MH2003PLC140116,NATIONAL COMMODITY AND DERIVATIVES EXCHANGE LIMITED,Active,RoC-Mumbai,140116.0,Public Limited Company,Maharashtra,Company limited by Shares,Non-govt company,Public,2003-04-23 00:00:00,"18 years, 11 month, 14 days",Other wholesale [Includes specialized wholesale not covered in any one of the previous categories and wholesale in a variety of goods without any particular specialization.],"₹700,000,000","₹506,760,000",Unlisted,2020-09-25 00:00:00,2020-03-31 00:00:00,SRINATH SRINIVASAN,Email ID: secretarialteam@ncdex.com,"1st Floor, Akruti Corporate Park, Near G. E. Garden, L.B.S. Road, Kanjurmarg (West) Mumbai Mumbai City MH 400078 IN","National Commodity And Derivatives Exchange Limited is a Public incorporated on 23 April 2003. It is classified as Non-govt company and is registered at Registrar of Companies, Mumbai. Its authorized share capital is Rs. 700,000,000 and its paid up capital is Rs. 506,760,000. It is inolved in Other wholesale [Includes specialized wholesale not covered in any one of the previous categories and wholesale in a variety of goods without any particular specialization.] National Commodity And Derivatives Exchange Limited's Annual General Meeting (AGM) was last held on 25 September 2020 and as per records from Ministry of Corporate Affairs (MCA), its balance sheet was last filed on 31 March 2020. Directors of National Commodity And Derivatives Exchange Limited are Srinath Srinivasan, Purvi Amitbhai Mehta Bhatt, Hemant Ratnakar Adarkar, Venkat Nageswar Chalasani, Sivaramakrishnan Manikumar, . National Commodity And Derivatives Exchange Limited's Corporate Identification Number is (CIN) U51909MH2003PLC140116 and its registration number is 140116.Its Email address is secretarialteam@ncdex.com and its registered address is 1st Floor, Akruti Corporate Park, Near G. E. Garden, L.B.S. Road, Kanjurmarg (West) Mumbai Mumbai City MH 400078 IN , - , . Current status of National Commodity And Derivatives Exchange Limited is - Active.",Futures,,Business services,"Mumbai, Maharashtra, India",2003-12-15 00:00:00,,,,,,,,,,,,,,,,,,,,,"Arun Raste, MD & CEO (in charge)",,Public Sector Enterprise,www.ncdex.com/index.aspx,,India,"Ministry of Finance , Government of India","National Commodity & Derivatives Exchange Limited (NCDEX) is an Indian online commodity and derivative exchange based in India. It is under the ownership of Ministry of Finance , Government of India. It has an independent board of directors and provides a commodity exchange platform for market participants to trade in commodity derivatives. It is a government company, incorporated on 23 April 2003 under the Companies Act, 1956 and obtained its Certificate for Commencement of Business on 9 May 2003. It commenced operations on 15 December 2003.",,,,Multi_Commodity_Exchange%2C_India_logo.svg,https://en.wikipedia.org/wiki/National_Commodity_and_Derivatives_Exchange
175,U67120MH1990NPL058298,OTC EXCHANGE OF INDIA,Under Liquidation,RoC-Mumbai,58298.0,Not-for-Profit License Company,Maharashtra,Company limited by Shares,Non-govt company,Public,1990-09-25 00:00:00,"31 years, 6 month, 12 days","Activities auxiliary to financial intermediation, except insurance and pension funding.[This Group includes activities involved in or closely related to financial inter-mediation other than insurance and pension funding but not themselves involving financial inter-mediation].","₹200,000,000","₹100,000,000",Unlisted,2018-09-26 00:00:00,2018-03-31 00:00:00,SUBHASH CHANDRA BHARGAVA,Email ID: otcei@otcei.net,92-93 Maker Tower F Cuff Parade Mumbai MUMBAI Mumbai City MH 400005 IN,"Otc Exchange Of India is a Public incorporated on 25 September 1990. It is classified as Non-govt company and is registered at Registrar of Companies, Mumbai. Its authorized share capital is Rs. 200,000,000 and its paid up capital is Rs. 100,000,000. It is inolved in Activities auxiliary to financial intermediation, except insurance and pension funding.[This Group includes activities involved in or closely related to financial inter-mediation other than insurance and pension funding but not themselves involving financial inter-mediation]. Otc Exchange Of India's Annual General Meeting (AGM) was last held on 26 September 2018 and as per records from Ministry of Corporate Affairs (MCA), its balance sheet was last filed on 31 March 2018. Directors of Otc Exchange Of India are Subhash Chandra Bhargava, Luke Benedict Fernandez, Deepak Gupta, . Otc Exchange Of India's Corporate Identification Number is (CIN) U67120MH1990NPL058298 and its registration number is 58298.Its Email address is otcei@otcei.net and its registered address is 92-93 Maker Tower F Cuff Parade Mumbai MUMBAI Mumbai City MH 400005 IN , - , . Current status of Otc Exchange Of India is - Under Liquidation.",,,,,1990 Started function in the year 1992,"Mumbai, India",,,,,,,,,,,,,,,,,,,,"Mr Praveen Mohnot, MD",,Public Sector Enterprise,www.otcei.net,,India,Government of India,"The OTC Exchange Of India was founded in 1990 under the Companies Act 1956 and was recognized by the Securities Contracts Regulation Act, 1956 as a stock exchange. The OTCEI is no longer a functional exchange as the same has been de-recognised by SEBI vide its order dated 31 Mar 2015.
OTCEI is promoted by the Unit Trust of India, the Industrial Credit and Investment Corporation of India, the Industrial Development Bank of India, the Industrial Finance Corporation of India, and other institutions, and is a recognised stock exchange under the SCR Act.",,,,NCDEX_Logo_.png,https://en.wikipedia.org/wiki/OTC_Exchange_of_India
176,L67120MH2005PLC155188,BSE LIMITED,Active,RoC-Mumbai,155188.0,Public Limited Company,Maharashtra,Company limited by Shares,Non-govt company,Public,2005-08-08 00:00:00,"16 years, 7 month, 30 days","Activities auxiliary to financial intermediation, except insurance and pension funding.[This Group includes activities involved in or closely related to financial inter-mediation other than insurance and pension funding but not themselves involving financial inter-mediation].","₹3,000,000,000","₹270,535,776",Listed,2021-08-24 00:00:00,2021-03-31 00:00:00,JAYSHREE ASHWINKUMAR VYAS,Email ID: vishal.bhat@bseindia.com,"25TH FLOOR,P J TOWERSDALAL STREET MUMBAI MH 400001 IN","Bse Limited is a Public incorporated on 08 August 2005. It is classified as Non-govt company and is registered at Registrar of Companies, Mumbai. Its authorized share capital is Rs. 3,000,000,000 and its paid up capital is Rs. 270,535,776. It is inolved in Activities auxiliary to financial intermediation, except insurance and pension funding.[This Group includes activities involved in or closely related to financial inter-mediation other than insurance and pension funding but not themselves involving financial inter-mediation]. Bse Limited's Annual General Meeting (AGM) was last held on 24 August 2021 and as per records from Ministry of Corporate Affairs (MCA), its balance sheet was last filed on 31 March 2021. Directors of Bse Limited are Jayshree Ashwinkumar Vyas, Vikramajit Sen, Sumit Bose, Subhash Sheoratan Mundra, Umakant Jayaram, David Jeremy Wright, Ashishkumar Manilal Chauhan, . Bse Limited's Corporate Identification Number is (CIN) L67120MH2005PLC155188 and its registration number is 155188.Its Email address is vishal.bhat@bseindia.com and its registered address is 25TH FLOOR,P J TOWERSDALAL STREET MUMBAI MH 400001 IN , - , . Current status of Bse Limited is - Active.",,,Stock exchange,"Mumbai, India",9 July 1875; 146 years ago,,,,,,,,,,,,,,,,,,,,"BSE SENSEX
S&P BSE SmallCap
S&P BSE MidCap
S&P BSE LargeCap
BSE 500",,,Public Sector Enterprise,,,India,,"Bombay Stock Exchange was started by Premchand Roychand in 1875. While BSE Limited is now synonymous with Dalal Street, it was not always so. In the 1850s, five stock brokers gathered together under a Banyan tree in front of Mumbai Town Hall, where Horniman Circle is now situated. A decade later, the brokers moved their location to another leafy setting, this time under banyan trees at the junction of Meadows Street and what was then called Esplanade Road, now Mahatma Gandhi Road. With a rapid increase in the number of brokers, they had to shift places repeatedly. At last, in 1874, the brokers found a permanent location, the one that they could call their own. The brokers group became an official organization known as ""The Native Share & Stock Brokers Association"" in 1875.",,,,,https://en.wikipedia.org/wiki/Bombay_Stock_Exchange
177,U67120WB1923PLC004707,THE CALCUTTA STOCK EXCHANGE LIMITED,Active,RoC-Kolkata,4707.0,Public Limited Company,West Bengal,Company limited by Shares,Non-govt company,Public,2023-06-07 00:00:00,"98 years, 10 month, 0 days","Activities auxiliary to financial intermediation, except insurance and pension funding.[This Group includes activities involved in or closely related to financial inter-mediation other than insurance and pension funding but not themselves involving financial inter-mediation].","₹100,000,000","₹618,750",Unlisted,2020-12-31 00:00:00,2020-03-31 00:00:00,GAUTAM GANGULI,Email ID: pdutta@cse-india.com,"7, LYONS RANGE, KOLKATA WB 700001 IN","The Calcutta Stock Exchange Limited is a Public incorporated on 07 June 1923. It is classified as Non-govt company and is registered at Registrar of Companies, Kolkata. Its authorized share capital is Rs. 100,000,000 and its paid up capital is Rs. 618,750. It is inolved in Activities auxiliary to financial intermediation, except insurance and pension funding.[This Group includes activities involved in or closely related to financial inter-mediation other than insurance and pension funding but not themselves involving financial inter-mediation]. The Calcutta Stock Exchange Limited's Annual General Meeting (AGM) was last held on 31 December 2020 and as per records from Ministry of Corporate Affairs (MCA), its balance sheet was last filed on 31 March 2020. Directors of The Calcutta Stock Exchange Limited are Gautam Ganguli, Ashok Banerjee, Bhaskar Banerjee, . The Calcutta Stock Exchange Limited's Corporate Identification Number is (CIN) U67120WB1923PLC004707 and its registration number is 4707.Its Email address is pdutta@cse-india.com and its registered address is 7, LYONS RANGE, KOLKATA WB 700001 IN , - , . Current status of The Calcutta Stock Exchange Limited is - Active.",,,,,1 December 1863; 158 years ago,"Kolkata, India",,,,,,,,,,,,,,,,,,,,"Dr Bhaskar Banerjee (Chairman)
Sri Subrato Das Managing Director & Chief Executive Officer",,Public Sector Enterprise,www.cse-india.com,,India,Government of India,"In 1830, bourse activities in Kolkata were conducted under a neem tree. The earliest record of dealings in securities in India records trading of the British East India Company’s loan stock. The exchange was founded on 1 December 1863 by sixteen leading stockbrokers, beginning life in rented premises on 11 Strand Road. The premises also had a library, open to the public, which could be accessed after paying an admission fee. In 1908, the stock exchange was reconstituted in its current form, and had 150 members. The present building at the Lyons Range was constructed in 1928. The Calcutta Stock Exchange Ltd was granted permanent recognition by the Government of India with effect from 14 April 1980, under the relevant provisions of the Securities Contracts (Regulation) Act, 1956. The Calcutta Stock Exchange followed the open outcry system for stock trading until 1997, when it was replaced by C-STAR (CSE Screen Based Trading And Reporting), an electronic trading platform.",,,,,https://en.wikipedia.org/wiki/Calcutta_Stock_Exchange
